{
  "$schema": "./region-geography-registry.schema.json",
  "schema_version": 1,
  "registry_id": "seoul-busan-sigungu",
  "code_system": "mois_sigungu",
  "as_of": "2026-08-03",
  "regions": [
    {
      "sido": "서울특별시",
      "sido_code": "11",
      "effective_from": null,
      "effective_to": null,
      "mapping_status": "effective_date_pending",
      "sigungu": [
        { "name": "종로구", "code": "11110" },
        { "name": "중구", "code": "11140" },
        { "name": "용산구", "code": "11170" },
        { "name": "성동구", "code": "11200" },
        { "name": "광진구", "code": "11215" },
        { "name": "동대문구", "code": "11230" },
        { "name": "중랑구", "code": "11260" },
        { "name": "성북구", "code": "11290" },
        { "name": "강북구", "code": "11305" },
        { "name": "도봉구", "code": "11320" },
        { "name": "노원구", "code": "11350" },
        { "name": "은평구", "code": "11380" },
        { "name": "서대문구", "code": "11410" },
        { "name": "마포구", "code": "11440" },
        { "name": "양천구", "code": "11470" },
        { "name": "강서구", "code": "11500" },
        { "name": "구로구", "code": "11530" },
        { "name": "금천구", "code": "11545" },
        { "name": "영등포구", "code": "11560" },
        { "name": "동작구", "code": "11590" },
        { "name": "관악구", "code": "11620" },
        { "name": "서초구", "code": "11650" },
        { "name": "강남구", "code": "11680" },
        { "name": "송파구", "code": "11710" },
        { "name": "강동구", "code": "11740" }
      ]
    },
    {
      "sido": "부산광역시",
      "sido_code": "26",
      "effective_from": null,
      "effective_to": null,
      "mapping_status": "effective_date_pending",
      "sigungu": [
        { "name": "중구", "code": "26110" },
        { "name": "서구", "code": "26140" },
        { "name": "동구", "code": "26170" },
        { "name": "영도구", "code": "26200" },
        { "name": "부산진구", "code": "26230" },
        { "name": "동래구", "code": "26260" },
        { "name": "남구", "code": "26290" },
        { "name": "북구", "code": "26320" },
        { "name": "해운대구", "code": "26350" },
        { "name": "사하구", "code": "26380" },
        { "name": "금정구", "code": "26410" },
        { "name": "강서구", "code": "26440" },
        { "name": "연제구", "code": "26470" },
        { "name": "수영구", "code": "26500" },
        { "name": "사상구", "code": "26530" },
        { "name": "기장군", "code": "26710" }
      ]
    }
  ]
}
